Date,Description,Category,Amount,Expense Type,Payment Method,Payment Status,Account/Bank,Tags/Labels,Notes
2023-08-03,Triple-buffered executive success,Housing,299.29,Expense,Debit Card,Paid,Chase Bank,lay,Raise traditional its impact risk.
2023-07-27,Configurable mission-critical infrastructure,Healthcare,1646.42,Expense,Bank Transfer,Pending,Citi Bank,several,Half bill whom suffer.
2023-04-20,Compatible secondary utilization,Groceries,5517.02,Income,Bank Transfer,Paid,Citi Bank,beyond,Young behavior green drop successful meeting summer some.
2023-04-17,Versatile reciprocal infrastructure,Housing,9631.57,Income,Bank Transfer,Overdue,Bank of America,clear,Approach himself operation third.
2023-05-21,Horizontal 3rdgeneration alliance,Healthcare,2044.15,Expense,Bank Transfer,Overdue,Chase Bank,dinner,Blue American yes position capital effort everyone final.
2022-12-12,Cross-platform secondary adapter,Healthcare,6908.32,Income,Debit Card,Overdue,Citi Bank,citizen,Relationship personal bill.
2023-04-07,Realigned responsive extranet,Dining Out,302.1,Expense,Cash,Paid,Wells Fargo,relationship,Paper current boy west rest environment street.
2022-11-09,Advanced asynchronous software,Transportation,9579.38,Income,Credit Card,Overdue,Citi Bank,glass,Style eat left successful ground partner especially.
2023-07-11,Inverse optimal function,Groceries,288.93,Expense,Bank Transfer,Paid,Bank of America,drug,Picture half lose certainly military perform southern happen.
2023-08-30,Inverse fault-tolerant hub,Healthcare,18.13,Expense,Debit Card,Paid,Chase Bank,add,Road measure pretty.
2023-08-29,Down-sized leadingedge model,Transportation,1741.94,Expense,Cash,Pending,Bank of America,enter,Return particular whether society near.
2023-08-26,Reduced fault-tolerant protocol,Dining Out,9061.7,Income,Cash,Overdue,Wells Fargo,away,Approach season former type book budget measure.
2023-05-29,Progressive value-added toolset,Housing,1006.77,Expense,Debit Card,Pending,Bank of America,compare,Others source town truth player hit.
2022-09-10,Inverse incremental challenge,Groceries,109.0,Expense,Bank Transfer,Pending,Chase Bank,sometimes,Suffer direction support important.
2023-01-21,Stand-alone context-sensitive encryption,Housing,9365.76,Income,Credit Card,Pending,Citi Bank,whatever,Congress field similar ball base.
2022-10-17,Cross-platform responsive interface,Housing,5968.21,Income,Bank Transfer,Pending,Citi Bank,peace,Prove institution they former once identify weight.
2022-09-22,Enhanced mission-critical info-mediaries,Dining Out,1285.46,Expense,Cash,Paid,Bank of America,culture,Young maintain day measure total hundred.
2023-01-31,Compatible leadingedge Local Area Network,Groceries,906.3,Expense,Bank Transfer,Paid,Bank of America,control,Apply represent seven concern despite.
2022-12-06,Future-proofed 24hour productivity,Dining Out,1630.06,Expense,Credit Card,Pending,Chase Bank,indicate,Great instead reflect two probably.
2023-06-15,Fully-configurable context-sensitive concept,Dining Out,78.21,Expense,Bank Transfer,Paid,Chase Bank,else,Way common firm data.
2023-02-06,Object-based non-volatile forecast,Dining Out,2949.47,Expense,Credit Card,Paid,Chase Bank,card,Two system leader meet start speak east.
2022-11-18,Advanced well-modulated encoding,Dining Out,638.93,Expense,Cash,Overdue,Bank of America,participant,Often example true hit give.
2023-04-01,User-friendly homogeneous secured line,Dining Out,2829.04,Expense,Credit Card,Paid,Wells Fargo,meet,Turn ball necessary begin fall why.
2023-04-28,User-centric intangible service-desk,Dining Out,1625.31,Expense,Bank Transfer,Paid,Citi Bank,reflect,Mouth them section live president watch.
2022-12-01,Distributed cohesive budgetary management,Housing,129.99,Expense,Cash,Paid,Citi Bank,city,Product fund table suffer present live public.
2023-07-06,Multi-layered global model,Dining Out,4453.9,Income,Debit Card,Pending,Wells Fargo,goal,Popular nature world as.
2023-06-20,Inverse attitude-oriented parallelism,Healthcare,2220.36,Income,Credit Card,Paid,Citi Bank,ok,Agent discussion degree Democrat data.
2023-03-01,Right-sized intangible focus group,Groceries,1949.04,Expense,Bank Transfer,Pending,Bank of America,avoid,Pretty thus about generation difference.
2023-08-24,Extended national utilization,Transportation,4311.22,Income,Bank Transfer,Overdue,Chase Bank,understand,Window fall clearly company community.
2022-12-13,Upgradable bifurcated Graphical User Interface,Groceries,8163.36,Income,Credit Card,Paid,Chase Bank,miss,School other hair outside former drive.
2023-08-19,Diverse exuding approach,Dining Out,2515.24,Income,Debit Card,Paid,Wells Fargo,meet,Several least skin prove cold.
2022-10-10,Quality-focused web-enabled Graphical User Interface,Housing,6744.21,Income,Debit Card,Overdue,Bank of America,high,Shoulder from window cup thought.
2023-01-13,Switchable systemic forecast,Groceries,2380.68,Income,Credit Card,Pending,Chase Bank,might,Yet two production ok.
2022-09-07,Distributed radical Graphical User Interface,Dining Out,503.27,Expense,Bank Transfer,Overdue,Chase Bank,worry,Type ask newspaper back remain idea sense inside.
2022-12-13,User-centric radical architecture,Dining Out,7105.43,Income,Credit Card,Paid,Wells Fargo,wait,Special each point animal want ask product.
2023-07-19,Front-line zero tolerance migration,Groceries,1597.65,Income,Debit Card,Overdue,Bank of America,two,Marriage significant more poor rate.
2022-10-16,Monitored didactic collaboration,Dining Out,4118.4,Income,Credit Card,Pending,Wells Fargo,beat,Before without food finish successful.
2022-11-11,Triple-buffered grid-enabled alliance,Housing,662.33,Expense,Bank Transfer,Overdue,Wells Fargo,fly,Vote play important claim beautiful research.
2023-07-25,Cloned client-server hub,Groceries,121.47,Expense,Debit Card,Paid,Bank of America,amount,Poor imagine town two should relationship morning.
2022-10-11,Total solution-oriented contingency,Housing,9956.66,Income,Debit Card,Paid,Citi Bank,lot,International mention good particular answer question almost perhaps.
2023-04-18,Pre-emptive web-enabled workforce,Transportation,8052.57,Income,Debit Card,Paid,Chase Bank,write,Employee heart year.
2022-11-16,Multi-tiered explicit forecast,Dining Out,2147.84,Expense,Debit Card,Overdue,Chase Bank,protect,Prepare teach fine computer she.
2023-04-27,Stand-alone 4thgeneration budgetary management,Healthcare,2625.61,Expense,Credit Card,Pending,Bank of America,almost,Four detail success area.
2022-09-20,Enhanced attitude-oriented throughput,Groceries,643.47,Expense,Cash,Pending,Citi Bank,consumer,Four hear cold yard include.
2023-06-21,Organic full-range success,Dining Out,47.06,Expense,Credit Card,Paid,Citi Bank,world,Explain pull yes popular say out.
2023-05-03,User-centric human-resource model,Dining Out,7974.49,Income,Bank Transfer,Paid,Bank of America,right,Prove way work watch deal quite color.
2023-01-25,Extended holistic archive,Groceries,1889.52,Expense,Bank Transfer,Paid,Wells Fargo,employee,Room ok gun anything story house those.
2023-09-04,Switchable zero tolerance toolset,Housing,1704.89,Expense,Credit Card,Pending,Wells Fargo,as,Politics relationship hard direction.
2023-07-09,Mandatory reciprocal workforce,Healthcare,2970.12,Expense,Bank Transfer,Pending,Chase Bank,large,Free south lose energy speak wife pressure.
2022-10-21,Exclusive intermediate parallelism,Transportation,2740.14,Expense,Debit Card,Paid,Citi Bank,scene,Feeling away year have.
2023-02-02,Object-based full-range productivity,Dining Out,280.34,Expense,Bank Transfer,Overdue,Wells Fargo,you,Discussion official fight action energy group goal feeling.
2023-07-26,Function-based high-level circuit,Housing,8564.09,Income,Bank Transfer,Paid,Bank of America,your,Month president enough.
2022-11-21,Reverse-engineered mobile middleware,Housing,3506.04,Income,Cash,Pending,Bank of America,measure,Me interesting young among none.
2023-04-03,Cloned national process improvement,Healthcare,259.94,Expense,Cash,Overdue,Chase Bank,against,Civil ten late successful paper.
2023-01-17,Enhanced zero-defect toolset,Groceries,8817.43,Income,Credit Card,Paid,Bank of America,language,Clearly example town thousand five sit owner.
2022-12-07,Down-sized web-enabled secured line,Dining Out,7660.4,Income,Credit Card,Overdue,Citi Bank,through,Doctor issue strategy test.
2023-04-28,Fundamental 6thgeneration forecast,Healthcare,1623.79,Income,Bank Transfer,Overdue,Chase Bank,factor,Bring environment couple front option tend.
2023-03-15,Cross-platform human-resource solution,Groceries,1565.45,Expense,Debit Card,Pending,Citi Bank,between,Feel suffer middle.
2023-08-18,Virtual interactive collaboration,Groceries,6885.64,Income,Cash,Overdue,Wells Fargo,guess,Tonight trial record like economy specific computer.
2023-03-31,Optional asymmetric productivity,Groceries,2495.89,Expense,Cash,Overdue,Bank of America,industry,Product itself parent baby.
2022-09-20,Down-sized context-sensitive superstructure,Transportation,4109.4,Income,Debit Card,Overdue,Wells Fargo,prove,Success help stand culture also wind.
2023-01-20,Implemented needs-based website,Transportation,6200.67,Income,Credit Card,Overdue,Citi Bank,scene,Strategy assume lead.
2022-10-13,Robust discrete productivity,Healthcare,6719.29,Income,Cash,Paid,Citi Bank,must,Tax happy statement tax pressure at black.
2023-08-04,Reduced human-resource function,Groceries,2980.19,Expense,Debit Card,Pending,Chase Bank,job,Big skin reach water.
2022-11-05,Multi-lateral local policy,Groceries,2275.04,Income,Cash,Paid,Wells Fargo,present,Measure question behind white myself allow agency win.
2022-12-14,Switchable user-facing moratorium,Transportation,9134.36,Income,Cash,Overdue,Bank of America,ground,Trouble computer now establish actually.
2022-12-27,Function-based tangible moratorium,Housing,1081.73,Expense,Debit Card,Overdue,Chase Bank,and,What quite evening candidate build surface.
2023-01-17,Versatile mobile capability,Transportation,8951.91,Income,Bank Transfer,Paid,Wells Fargo,quality,Measure high spring tonight strategy should.
2022-09-28,Triple-buffered coherent leverage,Groceries,4070.24,Income,Bank Transfer,Overdue,Chase Bank,yard,Way far recent avoid.
2023-06-09,Universal non-volatile knowledge user,Dining Out,5507.52,Income,Credit Card,Pending,Citi Bank,environment,Remember interest small recent still director safe.
