Date,Description,Category,Amount,Expense Type,Payment Method,Payment Status,Account/Bank,Tags/Labels,Notes
2022-09-23,Open-architected bi-directional database,Dining Out,1525.3,Expense,Credit Card,Paid,Chase Bank,resource,Political white contain level maintain most size.
2023-01-21,Multi-channeled regional portal,Housing,9198.75,Income,Bank Transfer,Overdue,Chase Bank,will,Agreement along foreign rule lot always.
2023-03-17,Customizable bi-directional array,Housing,5525.0,Income,Cash,Pending,Chase Bank,high,Cover pressure dream detail.
2022-10-29,Networked 5thgeneration Internet solution,Housing,2096.87,Expense,Debit Card,Paid,Wells Fargo,another,Contain ok eight.
2023-01-01,Operative multimedia capability,Housing,394.39,Expense,Debit Card,Paid,Bank of America,itself,Account wife really.
2022-09-15,Advanced secondary Local Area Network,Transportation,1305.97,Expense,Credit Card,Pending,Bank of America,life,Finally throughout leader.
2023-02-28,Up-sized impactful monitoring,Transportation,1939.54,Expense,Cash,Paid,Citi Bank,theory,Own would nature gun.
2023-04-19,Future-proofed empowering alliance,Housing,1560.97,Expense,Cash,Pending,Wells Fargo,matter,Successful meeting society eat arm poor.
2023-01-17,Multi-lateral multimedia moratorium,Transportation,2774.11,Expense,Bank Transfer,Overdue,Citi Bank,culture,Why tend tend value increase bill.
2023-03-06,Streamlined encompassing open system,Groceries,2074.93,Expense,Credit Card,Overdue,Bank of America,top,Majority computer story offer heavy.
2023-02-22,Mandatory executive alliance,Healthcare,4822.66,Income,Credit Card,Overdue,Wells Fargo,attorney,Evidence month certain national indeed.
2023-07-19,Reactive incremental orchestration,Housing,5129.6,Income,Credit Card,Overdue,Bank of America,remain,Stay term theory maybe great election will.
2022-11-04,Upgradable 3rdgeneration attitude,Housing,2358.76,Expense,Debit Card,Pending,Bank of America,movie,Friend painting few inside vote capital.
2023-07-20,Assimilated disintermediate knowledge user,Housing,9508.18,Income,Cash,Paid,Chase Bank,growth,Fire popular politics we.
2023-01-26,Front-line clear-thinking forecast,Dining Out,6840.06,Income,Cash,Pending,Citi Bank,hard,Action two decision sometimes.
2022-12-19,Polarized disintermediate structure,Housing,9734.41,Income,Bank Transfer,Overdue,Wells Fargo,ground,Produce race before space.
2023-01-02,Total national projection,Housing,6812.27,Income,Bank Transfer,Pending,Citi Bank,read,Visit land east.
2022-10-06,Quality-focused tangible migration,Housing,5.1,Expense,Bank Transfer,Overdue,Citi Bank,life,Worry about whom candidate relationship feel.
2022-10-24,Pre-emptive eco-centric access,Transportation,1151.74,Expense,Credit Card,Overdue,Bank of America,article,Determine security whole image agree point quite.
2023-03-15,Vision-oriented eco-centric monitoring,Healthcare,786.8,Expense,Bank Transfer,Pending,Chase Bank,store,Range away so.
2023-06-26,Operative analyzing open architecture,Housing,1360.64,Expense,Debit Card,Pending,Citi Bank,experience,Financial including service notice girl home adult.
2022-11-05,Secured national Graphic Interface,Housing,1335.89,Expense,Debit Card,Pending,Wells Fargo,character,Board century go light.
2023-09-05,Universal intangible hierarchy,Dining Out,1440.38,Expense,Credit Card,Pending,Bank of America,forward,Throw sort individual situation catch store.
2022-12-30,Cross-group impactful service-desk,Housing,2367.78,Expense,Cash,Paid,Chase Bank,spring,If food word thus draw purpose clear.
2023-08-10,Optimized leadingedge hub,Dining Out,806.91,Expense,Cash,Overdue,Bank of America,you,Animal view certainly direction summer page.
2023-02-17,Function-based multi-tasking superstructure,Healthcare,1692.01,Expense,Debit Card,Overdue,Chase Bank,question,More carry first thousand most.
2023-02-01,Profound foreground pricing structure,Healthcare,4265.1,Income,Credit Card,Pending,Chase Bank,theory,Citizen example again.
2022-12-15,Customer-focused value-added paradigm,Dining Out,2177.71,Expense,Bank Transfer,Overdue,Bank of America,step,I ago reflect speak.
2022-11-24,Cross-platform attitude-oriented collaboration,Transportation,2477.5,Income,Cash,Overdue,Bank of America,brother,Deep close old example change.
2023-07-25,Visionary bi-directional alliance,Housing,4429.93,Income,Bank Transfer,Paid,Citi Bank,trouble,Organization turn explain yeah easy rate property then.
2022-11-16,Progressive fault-tolerant conglomeration,Groceries,6938.02,Income,Bank Transfer,Paid,Wells Fargo,certainly,Make camera present industry message almost.
2023-07-22,Virtual foreground firmware,Transportation,336.22,Expense,Debit Card,Pending,Bank of America,be,Professional message series vote set.
2023-05-21,Intuitive even-keeled access,Groceries,1678.53,Income,Cash,Overdue,Chase Bank,clear,Word pressure reflect tax.
2022-09-18,Sharable high-level moderator,Transportation,2234.96,Expense,Cash,Paid,Bank of America,learn,Recognize determine especially responsibility audience eight military perhaps.
2022-12-19,Innovative empowering access,Healthcare,1987.29,Expense,Credit Card,Paid,Chase Bank,professional,Few theory author media hair from all prepare.
2023-04-15,Customizable modular challenge,Groceries,6281.51,Income,Credit Card,Paid,Bank of America,professional,Attack fly can notice.
2023-02-26,Stand-alone grid-enabled project,Healthcare,2400.05,Expense,Debit Card,Overdue,Wells Fargo,capital,Maybe control hair determine action.
2023-05-06,Organic reciprocal paradigm,Healthcare,2493.96,Income,Bank Transfer,Pending,Chase Bank,require,Above fly difficult wonder employee.
2023-06-15,Exclusive maximized capability,Housing,613.15,Expense,Cash,Pending,Wells Fargo,collection,Activity lose interesting those beyond treat.
2022-09-20,Extended radical open architecture,Housing,9674.37,Income,Cash,Overdue,Citi Bank,relate,News magazine billion cut.
2023-08-08,Reactive coherent hardware,Transportation,7134.54,Income,Cash,Paid,Chase Bank,idea,Building method discuss source somebody.
2022-10-29,Distributed interactive policy,Transportation,8963.03,Income,Debit Card,Overdue,Citi Bank,camera,Move among economy example technology both.
2023-02-05,Reduced foreground task-force,Healthcare,4453.18,Income,Debit Card,Pending,Chase Bank,pull,Campaign into suggest charge.
2023-05-13,Enterprise-wide encompassing circuit,Dining Out,1091.04,Expense,Cash,Overdue,Chase Bank,name,Possible begin treatment notice skill adult.
2023-01-14,Networked human-resource installation,Healthcare,6.11,Expense,Debit Card,Pending,Chase Bank,improve,Pressure feel nature authority always.
2022-09-23,Self-enabling actuating superstructure,Transportation,2325.9,Income,Cash,Paid,Citi Bank,style,Bit laugh serve.
2022-11-25,Progressive modular interface,Transportation,9943.47,Income,Debit Card,Pending,Bank of America,plan,Man particular image human voice.
2023-08-27,Fundamental intangible frame,Groceries,1003.89,Expense,Cash,Overdue,Chase Bank,total,Issue authority head say story.
2023-01-26,Realigned executive support,Healthcare,9090.52,Income,Cash,Paid,Citi Bank,mention,For woman summer everyone play adult board.
2023-08-07,Self-enabling actuating matrices,Housing,770.02,Expense,Cash,Paid,Bank of America,raise,Up prevent fight issue ago.
2022-11-03,Synchronized web-enabled challenge,Healthcare,9410.04,Income,Bank Transfer,Pending,Wells Fargo,yourself,Fear compare tough head example.
2023-07-05,Robust client-server open architecture,Healthcare,8642.7,Income,Credit Card,Paid,Bank of America,their,Break purpose list them street.
2023-06-17,Pre-emptive bifurcated array,Groceries,4516.31,Income,Debit Card,Overdue,Wells Fargo,voice,They sing point yeah.
2023-02-05,Open-architected analyzing complexity,Healthcare,9261.73,Income,Bank Transfer,Overdue,Chase Bank,finally,Pretty Mrs of add doctor Democrat.
2023-03-10,Managed human-resource productivity,Housing,6409.26,Income,Debit Card,Overdue,Bank of America,experience,Table discuss security important big which.
2022-12-21,Enterprise-wide didactic time-frame,Dining Out,2037.71,Expense,Cash,Overdue,Chase Bank,because,Vote story party.
2023-07-17,Cross-group 5thgeneration forecast,Groceries,1497.42,Expense,Debit Card,Paid,Bank of America,church,Scientist fight final good office high expert.
2023-01-23,Assimilated multi-state Internet solution,Groceries,5704.04,Income,Credit Card,Overdue,Wells Fargo,amount,Important approach building test like.
2022-12-03,Reactive executive core,Transportation,2394.24,Income,Debit Card,Overdue,Citi Bank,prepare,Eye media receive until instead.
2022-11-24,Versatile motivating migration,Transportation,3091.5,Income,Debit Card,Paid,Wells Fargo,city,Seek theory drop attention break.
2023-05-29,User-centric impactful matrices,Transportation,2495.82,Income,Bank Transfer,Paid,Citi Bank,author,Put how six into manage ball different.
2023-05-10,Decentralized intermediate capability,Groceries,2721.31,Income,Credit Card,Pending,Citi Bank,her,Make partner language my forget religious.
2022-11-12,Programmable bifurcated intranet,Healthcare,95.33,Expense,Cash,Pending,Chase Bank,take,Magazine image group nothing page evening us open.
2022-11-17,Configurable bifurcated secured line,Dining Out,4866.89,Income,Debit Card,Pending,Bank of America,however,Thought try tell table for east father father.
2023-06-18,Enhanced methodical array,Transportation,4416.58,Income,Bank Transfer,Pending,Chase Bank,for,Reduce middle network.
2023-06-27,Realigned methodical adapter,Housing,2540.96,Expense,Debit Card,Overdue,Chase Bank,near,Quite remain able rock.
2023-05-14,Mandatory user-facing hierarchy,Healthcare,3058.91,Income,Credit Card,Overdue,Chase Bank,office,Campaign nature among off eight already cultural.
2023-01-17,Persistent actuating archive,Groceries,2202.49,Expense,Bank Transfer,Paid,Wells Fargo,child,Tough sort lot oil despite.
2022-11-01,Digitized value-added policy,Dining Out,1759.15,Expense,Debit Card,Overdue,Wells Fargo,she,Their research else.
2023-07-15,Seamless systemic implementation,Healthcare,2795.71,Income,Debit Card,Overdue,Chase Bank,hold,Something none base each.
2023-04-22,Advanced full-range capacity,Groceries,514.12,Expense,Bank Transfer,Pending,Chase Bank,beat,Their raise soon sense term.
2023-01-13,Function-based explicit process improvement,Transportation,6793.82,Income,Credit Card,Overdue,Chase Bank,language,Month real guess TV case.
2022-09-27,Visionary well-modulated synergy,Healthcare,49.85,Expense,Debit Card,Paid,Chase Bank,participant,Accept understand account appear rock.
2022-11-27,Stand-alone hybrid frame,Dining Out,9722.24,Income,Debit Card,Pending,Citi Bank,long,Again board follow.
2022-09-08,Synchronized foreground budgetary management,Dining Out,1336.29,Expense,Bank Transfer,Paid,Citi Bank,to,Member back section every.
2023-05-27,Integrated methodical archive,Transportation,2717.7,Income,Credit Card,Overdue,Chase Bank,day,Population rate fear carry parent guy both.
2022-10-22,Polarized impactful productivity,Housing,7253.7,Income,Credit Card,Overdue,Citi Bank,month,Happen old senior pressure.
2022-10-03,Self-enabling fault-tolerant analyzer,Dining Out,1364.84,Income,Bank Transfer,Paid,Citi Bank,short,Support south though lawyer without letter.
2023-06-07,Universal reciprocal implementation,Healthcare,2165.06,Expense,Debit Card,Paid,Bank of America,camera,Shoulder difficult sense shoulder nearly hard.
2023-08-16,Horizontal attitude-oriented portal,Transportation,2182.08,Income,Cash,Pending,Wells Fargo,bill,Yeah table school threat with agree.
2022-12-16,Front-line leadingedge hub,Healthcare,2512.65,Expense,Debit Card,Overdue,Chase Bank,talk,Line marriage every seat analysis least.
2022-12-12,Re-contextualized user-facing success,Healthcare,1826.4,Expense,Cash,Paid,Citi Bank,like,Attorney theory still make.
2022-09-27,Phased intangible monitoring,Healthcare,2803.56,Expense,Bank Transfer,Overdue,Wells Fargo,recently,Statement left myself risk at direction.
2023-02-15,Operative optimizing functionalities,Housing,8943.4,Income,Debit Card,Pending,Citi Bank,edge,Other interesting remain improve station information.
2023-06-12,Fundamental 3rdgeneration framework,Transportation,2724.4,Expense,Cash,Pending,Wells Fargo,bill,Away few beautiful apply.
2022-12-25,Proactive zero tolerance groupware,Transportation,9530.75,Income,Bank Transfer,Pending,Chase Bank,future,Road two mouth church.
2022-12-14,Pre-emptive user-facing workforce,Healthcare,7351.79,Income,Bank Transfer,Pending,Chase Bank,total,National head hit.
2023-02-06,Exclusive 4thgeneration ability,Groceries,328.15,Expense,Cash,Overdue,Chase Bank,apply,Why travel assume yet bit.
2023-05-31,Open-architected solution-oriented superstructure,Groceries,134.83,Expense,Bank Transfer,Pending,Chase Bank,trial,Include opportunity institution drop we must almost.
2023-01-07,Versatile motivating knowledgebase,Transportation,9935.31,Income,Credit Card,Pending,Citi Bank,policy,Politics enjoy hour among.
2023-06-22,Front-line eco-centric open system,Housing,6651.39,Income,Credit Card,Paid,Bank of America,appear,Return head total suggest gun station.
2023-03-07,Robust client-driven encryption,Transportation,1389.28,Income,Debit Card,Pending,Bank of America,either,May main public everybody.
2023-01-13,Versatile encompassing interface,Transportation,9566.93,Income,Cash,Pending,Citi Bank,tree,Spring travel first service large.
2023-06-11,Reduced analyzing focus group,Healthcare,639.19,Expense,Bank Transfer,Overdue,Chase Bank,admit,Cost remain type.
2023-01-18,Public-key eco-centric frame,Groceries,5531.63,Income,Bank Transfer,Pending,Wells Fargo,hard,Bed structure beyond better various.
2023-07-20,Integrated contextually-based portal,Groceries,1162.93,Expense,Debit Card,Pending,Chase Bank,keep,Course break painting wide.
2023-03-21,Realigned 24hour encryption,Groceries,4663.7,Income,Bank Transfer,Pending,Citi Bank,key,Door down plan finally dog.
2023-05-18,De-engineered fault-tolerant interface,Healthcare,2087.08,Income,Cash,Overdue,Citi Bank,site,Own word present capital.
2022-09-17,Self-enabling context-sensitive parallelism,Dining Out,9863.12,Income,Debit Card,Paid,Chase Bank,them,Garden matter cause think.
2023-07-27,Cloned multi-tasking help-desk,Transportation,2021.92,Expense,Credit Card,Paid,Citi Bank,street,Certainly tough for technology.
2022-12-15,Versatile empowering algorithm,Housing,3912.06,Income,Bank Transfer,Overdue,Chase Bank,certain,Back add response.
2022-12-26,Business-focused object-oriented intranet,Dining Out,1726.89,Expense,Bank Transfer,Pending,Bank of America,give,Ready still break mother.
2023-05-18,Balanced regional array,Housing,306.31,Expense,Debit Card,Overdue,Chase Bank,adult,Together teacher bar air wish green perform.
2022-12-15,Organic well-modulated encryption,Dining Out,2672.54,Expense,Bank Transfer,Pending,Citi Bank,young,Appear central paper significant media enough.
2022-11-26,De-engineered cohesive knowledge user,Transportation,1250.7,Expense,Bank Transfer,Overdue,Bank of America,stop,Sign fear couple analysis scientist moment.
2023-07-16,Monitored upward-trending application,Dining Out,9574.39,Income,Debit Card,Overdue,Citi Bank,threat,Continue after present leave.
2023-08-09,Quality-focused client-server orchestration,Groceries,8247.28,Income,Bank Transfer,Paid,Wells Fargo,economic,Wind statement follow.
2023-03-26,Polarized bandwidth-monitored success,Healthcare,5626.14,Income,Debit Card,Pending,Bank of America,international,Far star traditional economy send.
2023-01-05,Versatile analyzing secured line,Transportation,5314.84,Income,Debit Card,Overdue,Wells Fargo,government,All child executive attack.
2023-06-15,Fully-configurable bi-directional process improvement,Housing,1037.32,Expense,Credit Card,Paid,Citi Bank,ask,Spend ability trip Mrs.
2022-09-29,Versatile explicit encoding,Groceries,1534.33,Expense,Cash,Paid,Bank of America,player,Modern his ever.
2023-02-12,Re-contextualized high-level software,Transportation,1321.33,Expense,Debit Card,Paid,Chase Bank,hard,Stage move window card lot window power.
2022-11-06,Pre-emptive hybrid Graphic Interface,Transportation,7439.82,Income,Cash,Pending,Chase Bank,sister,Author result whom similar color management idea.
2023-01-21,Optional didactic throughput,Transportation,3210.47,Income,Bank Transfer,Pending,Citi Bank,range,Today during idea across skin.
2023-05-18,Sharable empowering structure,Groceries,8679.78,Income,Cash,Paid,Citi Bank,question,Life cold statement especially everyone class.
2023-04-18,Up-sized local capacity,Transportation,2989.06,Expense,Debit Card,Overdue,Wells Fargo,baby,Appear nothing which painting today.
2023-06-25,Decentralized impactful collaboration,Groceries,6111.48,Income,Credit Card,Overdue,Bank of America,event,Coach poor would my.
2022-11-21,Reactive background capability,Groceries,914.33,Expense,Cash,Pending,Bank of America,under,According what likely service.
2023-08-17,Profound hybrid access,Groceries,5475.0,Income,Cash,Pending,Citi Bank,policy,City news interview wife organization let.
2022-09-14,Reactive systemic strategy,Healthcare,1864.07,Expense,Credit Card,Paid,Chase Bank,maybe,Return officer record.
2023-02-12,Customizable demand-driven attitude,Groceries,1021.87,Expense,Credit Card,Paid,Citi Bank,figure,Sense stuff interest father catch special less.
2023-05-24,Team-oriented optimal functionalities,Healthcare,2676.23,Expense,Debit Card,Overdue,Chase Bank,sing,Piece part seem theory certainly partner simply.
2023-03-18,Vision-oriented eco-centric data-warehouse,Housing,5520.1,Income,Credit Card,Paid,Chase Bank,focus,Wait mouth amount under traditional wife half.
2022-12-25,Optimized zero administration strategy,Transportation,4730.34,Income,Cash,Paid,Bank of America,concern,Deal career pressure might sea say high.
2023-01-18,Intuitive systematic adapter,Transportation,8210.79,Income,Cash,Overdue,Bank of America,bank,Per agent value reality.
2022-12-26,Managed incremental core,Groceries,1628.5,Expense,Cash,Overdue,Wells Fargo,job,True him eat during issue.
2023-03-10,Optional zero administration system engine,Housing,2910.63,Expense,Bank Transfer,Paid,Bank of America,bit,Thank near character tough health nearly.
2023-03-26,Diverse zero administration database,Groceries,2181.9,Income,Bank Transfer,Pending,Chase Bank,but,Number successful wrong hotel notice require analysis.
2023-01-01,Persevering full-range function,Groceries,82.64,Expense,Debit Card,Pending,Citi Bank,stay,Production mention sing.
2022-11-28,Reactive bottom-line software,Transportation,2748.45,Expense,Credit Card,Overdue,Citi Bank,front,While carry successful follow of want.
2023-04-03,Optional bifurcated ability,Transportation,4719.72,Income,Credit Card,Overdue,Bank of America,suffer,Teacher quite including than subject lay.
2022-11-30,Multi-tiered systematic alliance,Dining Out,2773.38,Income,Cash,Overdue,Chase Bank,produce,Idea early edge ok.
2023-07-18,Triple-buffered neutral process improvement,Dining Out,1375.02,Expense,Credit Card,Pending,Bank of America,development,Almost present case option especially drop traditional.
2023-09-02,Horizontal content-based neural-net,Housing,6045.52,Income,Debit Card,Pending,Citi Bank,arrive,Year deal history shake.
2022-09-29,Profit-focused impactful encoding,Housing,8185.36,Income,Cash,Paid,Bank of America,term,Become gun between ability development customer.
2023-02-05,Open-source methodical archive,Dining Out,1186.54,Expense,Debit Card,Overdue,Chase Bank,determine,Moment walk try ball pretty.
2023-08-06,De-engineered national website,Housing,1424.77,Expense,Bank Transfer,Paid,Bank of America,listen,Partner many Congress enjoy.
2023-05-02,Versatile 3rdgeneration matrices,Healthcare,2668.18,Expense,Cash,Overdue,Wells Fargo,long,Realize star discussion past minute.
2022-09-12,User-centric holistic initiative,Dining Out,2849.31,Expense,Credit Card,Pending,Chase Bank,relate,Mind doctor bill walk because spend.
2023-07-05,Profit-focused mobile knowledgebase,Transportation,2048.36,Expense,Credit Card,Overdue,Chase Bank,computer,Red likely question.
2023-05-03,Decentralized transitional collaboration,Transportation,2815.98,Expense,Bank Transfer,Overdue,Bank of America,usually,Customer in body.
2023-09-07,Synergized value-added contingency,Transportation,7041.01,Income,Debit Card,Pending,Wells Fargo,whether,Human without successful miss.
2023-09-06,Adaptive heuristic parallelism,Transportation,3630.86,Income,Debit Card,Overdue,Bank of America,gas,Wall card writer though our president would.
2023-06-24,Stand-alone full-range paradigm,Dining Out,1994.07,Expense,Bank Transfer,Overdue,Bank of America,current,Seven fast partner statement manage stop everyone.
2022-12-27,Monitored optimal collaboration,Healthcare,5585.17,Income,Bank Transfer,Paid,Wells Fargo,anything,Quality unit floor score mention.
2022-12-01,Customer-focused system-worthy flexibility,Transportation,1059.42,Expense,Debit Card,Overdue,Bank of America,your,Development large pull those rich discover.
2022-09-23,Synergized maximized policy,Housing,1133.07,Expense,Bank Transfer,Pending,Citi Bank,case,Actually figure section brother.
2023-04-12,Seamless value-added benchmark,Housing,2896.14,Expense,Debit Card,Overdue,Chase Bank,billion,Seat real believe feeling.
2023-06-16,Progressive explicit hardware,Healthcare,9332.18,Income,Debit Card,Pending,Wells Fargo,image,Sit station second seat.
2023-08-17,Enterprise-wide tangible Local Area Network,Transportation,1085.89,Income,Bank Transfer,Paid,Wells Fargo,employee,None pattern treatment news over dinner phone be.
2022-10-11,Upgradable optimal info-mediaries,Housing,2415.0,Expense,Debit Card,Overdue,Wells Fargo,mention,Well left back material article laugh window.
2022-11-12,Switchable intangible ability,Groceries,2764.9,Expense,Cash,Pending,Wells Fargo,begin,Remain air him open its dinner wish chair.
2022-10-05,Multi-tiered real-time portal,Housing,4271.66,Income,Cash,Pending,Wells Fargo,fund,Answer begin event yeah weight reason.
2022-12-14,User-centric zero-defect access,Transportation,2662.12,Income,Cash,Pending,Chase Bank,experience,Light daughter hot Democrat dream trial.
2023-05-27,Customizable real-time productivity,Healthcare,9726.68,Income,Debit Card,Overdue,Citi Bank,foot,Pressure seat box.
2022-11-06,Compatible coherent toolset,Dining Out,1728.74,Expense,Bank Transfer,Paid,Citi Bank,knowledge,Official support machine own.
2023-05-31,Enterprise-wide attitude-oriented website,Groceries,2894.72,Expense,Debit Card,Pending,Bank of America,sell,Difference place drug enough site mission.
2023-02-23,Reactive upward-trending circuit,Groceries,7406.44,Income,Credit Card,Paid,Bank of America,bed,Woman someone foot billion true keep news political.
2023-02-12,Exclusive content-based customer loyalty,Housing,1060.77,Expense,Debit Card,Overdue,Wells Fargo,strategy,Knowledge experience fact today.
2023-07-23,Public-key fault-tolerant circuit,Dining Out,484.85,Expense,Bank Transfer,Overdue,Chase Bank,pull,Available environmental help south easy could.
2022-10-11,Multi-channeled well-modulated challenge,Healthcare,2109.44,Income,Debit Card,Pending,Bank of America,relationship,Green far ever move light form.
2022-12-04,Horizontal coherent parallelism,Dining Out,2347.25,Expense,Debit Card,Overdue,Bank of America,democratic,Ability attention guess hotel study stand.
2022-10-08,Synchronized even-keeled hub,Healthcare,3192.11,Income,Debit Card,Pending,Wells Fargo,fish,Plant data end property realize back.
2023-03-13,Progressive methodical knowledgebase,Healthcare,1311.43,Expense,Bank Transfer,Paid,Citi Bank,performance,Page series nice.
2022-10-23,Right-sized secondary interface,Transportation,8810.77,Income,Credit Card,Overdue,Bank of America,across,Until everyone employee drive appear attention voice.
2022-11-29,Right-sized modular array,Housing,9626.81,Income,Cash,Pending,Citi Bank,end,Risk tell couple movie prevent many course.
2022-09-30,Organized solution-oriented architecture,Housing,4064.43,Income,Credit Card,Paid,Citi Bank,suffer,Study any region participant.
2023-05-17,Function-based system-worthy productivity,Transportation,1552.22,Expense,Cash,Pending,Citi Bank,town,Her couple student cold above message that simple.
2023-08-02,Profound asymmetric secured line,Groceries,1109.41,Expense,Bank Transfer,Pending,Wells Fargo,meet,Others president institution series.
2022-10-03,Team-oriented 3rdgeneration benchmark,Groceries,1441.98,Expense,Cash,Paid,Citi Bank,ground,Leader picture through both your cell listen you.
2023-08-01,Advanced 5thgeneration collaboration,Dining Out,3199.03,Income,Debit Card,Overdue,Bank of America,situation,Short key no there way.
2022-11-27,Reverse-engineered tangible system engine,Housing,3796.33,Income,Debit Card,Paid,Wells Fargo,join,Ability set lead realize arm fall.
2023-01-30,Monitored homogeneous Local Area Network,Groceries,1261.18,Expense,Credit Card,Paid,Wells Fargo,writer,Thought do avoid attention box finally student.
2022-11-07,Universal leadingedge conglomeration,Healthcare,7581.6,Income,Debit Card,Paid,Citi Bank,collection,Option million page loss method everybody paper.
2023-07-01,Enterprise-wide cohesive firmware,Transportation,311.07,Expense,Cash,Overdue,Citi Bank,like,People thousand page white hair.
2022-11-05,Future-proofed bottom-line Internet solution,Transportation,2481.5,Expense,Cash,Paid,Wells Fargo,candidate,Very adult stock reflect doctor describe who mean.
2022-11-16,Stand-alone cohesive budgetary management,Dining Out,2510.89,Expense,Debit Card,Pending,Chase Bank,total,Grow husband suggest stuff international your.
2023-05-07,Operative 6thgeneration utilization,Transportation,7827.64,Income,Debit Card,Pending,Wells Fargo,our,State charge than thing.
2022-12-01,Adaptive exuding ability,Housing,47.94,Expense,Cash,Paid,Wells Fargo,knowledge,Yeah guess bring go involve possible.
2023-03-03,Operative 6thgeneration knowledge user,Housing,6811.43,Income,Cash,Paid,Bank of America,need,Accept some system left.
